{
  "id": "ver_eb3c12",
  "name": "express",
  "version": "4.18.2",
  "prerelease": false,
  "package_id": "pkg_eb3c12",
  "kind_key": "js",
  "filename": "express-4.18.2.tgz",
  "digests": {
    "sha256": "a1b2c3d4e5f6a1b2c3d4e5f6a1b2c3d4e5f6a1b2c3d4e5f6a1b2c3d4e5f6a1b2"
  },
  "download_url": "https://npm.fury.io/myorg/express/-/express-4.18.2.tgz",
  "created_at": "2023-01-15T12:00:00Z"
}
